{
  "entity_type": "observation",
  "schema_version": "1.0.0",
  "observation_id": "OBS-T1-GEMINI-P17",
  "run_id": "RUN-M08-1-T1-REF",
  "prompt_id": "P17",
  "environment_id": "ENV-GEMINI",
  "observed_at": "2026-09-27T00:00:00Z",
  "raw_response_id": "EVD-VIS-T1-GEMINI-P17",
  "mention": "YES",
  "citation_signal": "NO",
  "verified_citation": "NO",
  "retrieval": "UNVERIFIED",
  "entity_recognition": "UNVERIFIED",
  "context_accuracy": "UNVERIFIED",
  "confidence": "HIGH",
  "qa_status": "VERIFIED",
  "evidence_ids": [
    "EVD-VIS-T1-GEMINI-P17"
  ],
  "is_immutable": true,
  "notes": "Branded prompt recognized only as an unverified/poorly documented name; response does not establish retrieval of LOCATRIA website."
}