{
  "entity_type": "observation",
  "schema_version": "1.0.0",
  "observation_id": "OBS-T1-CHATGPT-P17",
  "run_id": "RUN-M08-1-T1-REF",
  "prompt_id": "P17",
  "environment_id": "ENV-CHATGPT",
  "observed_at": "2026-09-27T00:00:00Z",
  "raw_response_id": "EVD-VIS-T1-CHATGPT-P17",
  "mention": "YES",
  "citation_signal": "YES",
  "verified_citation": "NO",
  "retrieval": "UNVERIFIED",
  "entity_recognition": "CORRECT",
  "context_accuracy": "ACCURATE",
  "confidence": "MEDIUM",
  "qa_status": "VERIFIED",
  "evidence_ids": [
    "EVD-VIS-T1-CHATGPT-P17"
  ],
  "is_immutable": true,
  "notes": "Raw export contains 'Locatria'/'Locatria+N' source label, but no locatria.com URL; citation/retrieval cannot be independently verified from this export."
}