{
  "entity_type": "observation",
  "schema_version": "1.0.0",
  "observation_id": "OBS-T1-CHATGPT-P06",
  "run_id": "RUN-M08-1-T1-REF",
  "prompt_id": "P06",
  "environment_id": "ENV-CHATGPT",
  "observed_at": "2026-09-27T00:00:00Z",
  "raw_response_id": "EVD-VIS-T1-CHATGPT-P06",
  "mention": "NO",
  "citation_signal": "NO",
  "verified_citation": "NO",
  "retrieval": "UNVERIFIED",
  "entity_recognition": "N/A",
  "context_accuracy": "N/A",
  "confidence": "HIGH",
  "qa_status": "VERIFIED",
  "evidence_ids": [
    "EVD-VIS-T1-CHATGPT-P06"
  ],
  "is_immutable": true,
  "notes": "T1 Reference observation for ChatGPT P06."
}